{
  "id": "kim-kardashian-maybach",
  "ownerId": "kim-kardashian",
  "category": "car",
  "name": "Mercedes-Maybach",
  "make": "Mercedes-Benz",
  "model": "Maybach",
  "status": "unverified",
  "confidence": "low",
  "estimatedValueUsd": 400000,
  "summary": "Placeholder entry pending a dated, linkable source. Do not publish as verified without one.",
  "sources": [
    {
      "title": "TODO — add source",
      "url": "TODO"
    }
  ],
  "updatedAt": "2026-09-01",
  "imageUrl": "https://thumb.wikimedia.org/wikipedia/commons/thumb/8/87/Mercedes-Maybach_Z223_680_1X7A5831.jpg/960px-Mercedes-Maybach_Z223_680_1X7A5831.jpg",
  "imageCredit": {
    "url": "https://thumb.wikimedia.org/wikipedia/commons/thumb/8/87/Mercedes-Maybach_Z223_680_1X7A5831.jpg/960px-Mercedes-Maybach_Z223_680_1X7A5831.jpg",
    "author": "Alexander Migl",
    "license": "CC BY-SA 4.0",
    "sourcePage": "https://commons.wikimedia.org/wiki/File:Mercedes-Maybach_Z223_680_1X7A5831.jpg"
  },
  "imageIsRepresentative": true
}
